<?xml version="1.0" encoding="utf-8"?>
<!-- ===================================================================== -->
<!--
 * This file is part of CARDAMOM (R) which is jointly developed by THALES
 * and SELEX-SI. It is derivative work based on PERCO Copyright (C) THALES
 * 2000-2003. All rights reserved.
 * 
 * Copyright (C) THALES 2004-2005. All rights reserved
 * 
 * CARDAMOM is free software; you can redistribute it and/or modify it
 * under the terms of the GNU Library General Public License as published
 * by the Free Software Foundation; either version 2 of the License, or
 * (at your option) any later version.
 * 
 * CARDAMOM is distributed in the hope that it will be useful, but WITHOUT
 * ANY WARRANTY; without even the implied warranty of MERCHANTABILITY or
 * FITNESS FOR A PARTICULAR PURPOSE. See the GNU Library General Public
 * License for more details.
 * 
 * You should have received a copy of the GNU Library General Public
 * License along with CARDAMOM; see the file COPYING. If not, write to the
 * Free Software Foundation, Inc., 675 Mass Ave, Cambridge, MA 02139, USA.
-->
<!-- ===================================================================== -->


<!DOCTYPE System SYSTEM "./CdmwPlatformMngtSystem.dtd">

<!-- ***************** -->
<!-- System definition -->
<!--                   -->
<!-- ***************** -->

<System Name="MySystem" Port="21869">

	<!-- Default timeouts for processes of the entire system -->
	<Timeout Init="20000" Run="20000" Stop="20000"/>
	<!-- Default monitorings for the entire system -->
	<Host-monitoring Pull-interval="1000" Pull-timeout="1500"/>
	<App-monitoring Pull-interval="060" Pull-timeout="070"/>
	<Proc-monitoring Model="NO_MONITORING" 
	                 Pull-interval="021" Pull-timeout="031" 
	                 Push-interval="041" Push-timeout="051"/>
	
	<!-- Services of the system -->
	<!-- <Service Name="NamingAndRepositoryService" 
	         App-name="CardamomServices" 
	         Process-name="Repository"/>  -->
            <!--	     
	      App-exec-path="/home/florenna/MINICARDAMOM_DEVELOP/CARDAMOM_INSTALLED/bin/cdmw_platform_application" 
	      Agent-exec-path="/home/florenna/MINICARDAMOM_DEVELOP/CARDAMOM_INSTALLED/bin/cdmw_platform_agent" 
	      Probe-exec-path="/home/florenna/MINICARDAMOM_DEVELOP/CARDAMOM_INSTALLED/bin/cdmw_host_probe">
	      -->
	
	<!-- Hosts of the system -->
	<Host Name="@host_name@"  >
		<Host-monitoring Pull-interval="2000" Pull-timeout="2500"/>
	</Host>
	
	<!-- ********************** -->
	<!-- Application definition -->
	<!--                        -->
	<!-- ********************** -->
	<Application Name="HELLO_WORLD" 
	             Agent-port="-1" 
	             App-port="-1">
	             
		<!-- Default timeouts for processes of this application -->
		<Timeout Init="20000" Run="20000" Stop="20000"/>
		
		<!-- Monitoring of this application -->
		<App-monitoring Pull-interval="021" Pull-timeout="031"/>
		
		<!-- ******************* -->
		<!-- Process definitions -->
		<!--                     -->
		<!-- ******************* -->
               <Unmanaged-process Name="HelloProcess1"
                     Host-name="@host_name@" 
                     Autoended="TRUE" 
                     Exec-path="./proc1.csh"
		     Port="-1" />
		     

               <Unmanaged-process Name="HelloProcess2"
                     Host-name="@host_name@" 
                     Autoended="TRUE" 
                     Exec-path="./proc2.csh"
		     Port="-1" />
		    

               <Unmanaged-process Name="HelloProcess3"
                     Host-name="@host_name@" 
                     Autoended="TRUE" 
                     Exec-path="./proc3.csh"
		     Port="-1" />
		   
		
		<!-- ************************** -->
		<!--                            -->
		<!-- End of process definitions -->
		<!-- ************************** -->
		
		<!-- Init graph of processes of this application -->
		<Init-graph>
		    <Graph-element Name="HelloProcess1">
			<Graph-element-successor Name="HelloProcess2"  />
			</Graph-element> 

		    <Graph-element Name="HelloProcess2">
			<Graph-element-successor Name="HelloProcess3"  />
			</Graph-element> 

			<Graph-element-root Name="HelloProcess1"/>
		</Init-graph>
		
		<!-- ***************************** -->
		<!--                               -->
		<!-- End of application definition -->
		<!-- ***************************** -->
	</Application>
	
	
	<!-- Stop graph of applications of the system-->
	
	<Init-graph>
		    <Graph-element Name="HELLO_WORLD">
			</Graph-element> 
			<Graph-element-root Name="HELLO_WORLD"/>
	</Init-graph>
	
	<Stop-graph>
		<Graph-element Name="HELLO_WORLD">
		</Graph-element>
		<Graph-element-root Name="HELLO_WORLD"/>
	</Stop-graph> 

<!-- Run sets of the system -->
<!--
<Run-set Name="RS1">
  <Run-set-element Name="HelloProcess1"/>
  <Run-set-element Name="HelloProcess2"/>
  <Run-set-element Name="HelloProcess3"/>
</Run-set>
-->
	
	
</System>

<!-- ************************ -->
<!--                          -->
<!-- End of system definition -->
<!-- ************************ -->
