<?xml version="1.0" encoding="utf-8"?>
<!--
 * =========================================================================== *
 * This file is part of CARDAMOM (R) which is jointly developed by THALES
 * and SELEX-SI.
 * 
 * It is derivative work based on PERCO Copyright (C) THALES 2000-2003.
 * All rights reserved.
 * 
 * CARDAMOM is free software; you can redistribute it and/or modify it under
 * the terms of the GNU Library General Public License as published by the
 * Free Software Foundation; either version 2 of the License, or (at your
 * option) any later version.
 * 
 * CARDAMOM is distributed in the hope that it will be useful, but WITHOUT
 * ANY WARRANTY; without even the implied warranty of MERCHANTABILITY or
 * FITNESS FOR A PARTICULAR PURPOSE. See the GNU Library General Public
 * License for more details.
 * 
 * You should have received a copy of the GNU Library General
 * Public License along with CARDAMOM; see the file COPYING. If not, write to
 * the Free Software Foundation, Inc., 675 Mass Ave, Cambridge, MA 02139, USA.
 * =========================================================================== *
-->

<!DOCTYPE System SYSTEM "CdmwPlatformMngtSystem.dtd">

<!-- ***************** -->
<!-- System definition -->
<!--                   -->
<!-- ***************** -->

<System Name="Validation" Port="21869">
    <!-- Default timeouts for processes of the entire system -->
	<Timeout Init="20000" Run="20000" Stop="20000"/>

    <!-- Default monitorings for the entire system -->
	<Host-monitoring Pull-interval="1000" Pull-timeout="1500"/>
	<App-monitoring  Pull-interval="060" Pull-timeout="070"/>
    <Proc-monitoring Model="NO_MONITORING"
                     Pull-interval="021" Pull-timeout="031"
                     Push-interval="041" Push-timeout="051"/>

    <!-- Entities of the system -->
	<Entity  Name="SYSTEM_ENTITY"/>


    <!-- Hosts of the system -->
	<Host Name="@hostname1val@"
          App-exec-path="cdmw_platform_application"
          Agent-exec-path="cdmw_platform_agent">
        <!-- Entities of the host -->
        <Entity  Name="HOST_ENTITY"/>
    </Host>

	<Host Name="@hostname2val@"
          App-exec-path="cdmw_platform_application"
          Agent-exec-path="cdmw_platform_agent"/>




    <!-- ********************** -->
    <!-- Application definition -->
    <!--                        -->
    <!-- ********************** -->
	<Application Name="NavigationApplication1"
                 Host-name="@hostname1val@"
                 Agent-port="-1"
                 App-port="-1">

        <!-- Default timeouts for processes of this application -->
	    <Timeout Init="20000" Run="20000" Stop="20000"/>

        <!-- Monitoring of this application -->
    	<App-monitoring Pull-interval="021" Pull-timeout="031"/>

        <!-- Entities of this application -->
	    <Entity  Name="APPLICATION_ENTITY1"/>

        <!-- ******************* -->
        <!-- Process definitions -->
        <!--                     -->
        <!-- ******************* -->
	    <Managed-process Name="NavigationProcess1"
                         Host-name="@hostname1val@"
                         Type="MANAGED-PROCESS"
                         Autoended="TRUE"
                         Exec-path="cdmw_test_navigation"
                         Args="--CdmwXMLFile=NavigationTest.xml --validateXML --host1=@hostname1val@ --host2=@hostname2val@ --supervision=corbaloc::@hostname1val@:21871/CdmwPlatformMngtSupervision"
								 Port="-1">
			<Init-step Name="step0" Timeout="10000"/>

            <!-- Entities of this process -->
	        <Entity  Name="PROCESS_ENTITY1"/>

		</Managed-process>

        <!-- ************************** -->
        <!--                            -->
        <!-- End of process definitions -->
        <!-- ************************** -->

        <!-- Init graph of processes of this application -->
        <Init-graph>
            <Graph-element Name="NavigationProcess1">
            </Graph-element>
            <Graph-element-root Name="NavigationProcess1"/>
        </Init-graph>

    <!-- ***************************** -->
    <!--                               -->
    <!-- End of application definition -->
    <!-- ***************************** -->
	</Application>

    <!-- ********************** -->
    <!-- Application definition -->
    <!--                        -->
    <!-- ********************** -->
	<Application Name="NavigationApplication2"
                 Host-name="@hostname2val@"
                 Agent-port="-1"
                 App-port="-1">

        <!-- Default timeouts for processes of this application -->
	    <Timeout Init="20000" Run="20000" Stop="20000"/>

        <!-- Monitoring of this application -->
    	<App-monitoring Pull-interval="021" Pull-timeout="031"/>

        <!-- Entities of this application -->
	    <Entity  Name="APPLICATION_ENTITY2"/>


        <!-- ******************* -->
        <!-- Process definitions -->
        <!--                     -->
        <!-- ******************* -->
	    <Managed-process Name="NavigationProcess2"
                         Host-name="@hostname2val@"
                         Type="MANAGED-PROCESS"
                         Autoended="TRUE"
                         Exec-path="cdmw_test_navigation"
                         Args="--CdmwXMLFile=NavigationTest.xml --validateXML"
								 Port="-1">
			<Init-step Name="step0" Timeout="10000"/>

            <!-- Entities of this process -->
	        <Entity  Name="PROCESS_ENTITY2"/>

		</Managed-process>

        <!-- ************************** -->
        <!--                            -->
        <!-- End of process definitions -->
        <!-- ************************** -->

        <!-- Init graph of processes of this application -->
        <Init-graph>
            <Graph-element Name="NavigationProcess2">
            </Graph-element>
            <Graph-element-root Name="NavigationProcess2"/>
        </Init-graph>

    <!-- ***************************** -->
    <!--                               -->
    <!-- End of application definition -->
    <!-- ***************************** -->
	</Application>

    <!-- Init graph of applications of the system-->
    <Init-graph>
        <Graph-element Name="NavigationApplication1"> 
            <Graph-element-successor Name="NavigationApplication2"/>
        </Graph-element>
        <Graph-element-root Name="NavigationApplication1"/> 
    </Init-graph>

</System>
<!-- ************************ -->
<!--                          -->
<!-- End of system definition -->
<!-- ************************ -->

