<?xml version="1.0" encoding="utf-8"?>
<!--
 * =========================================================================== *
 * This file is part of CARDAMOM (R) which is jointly developed by THALES
 * and SELEX-SI.
 * 
 * It is derivative work based on PERCO Copyright (C) THALES 2000-2003.
 * All rights reserved.
 * 
 * CARDAMOM is free software; you can redistribute it and/or modify it under
 * the terms of the GNU Library General Public License as published by the
 * Free Software Foundation; either version 2 of the License, or (at your
 * option) any later version.
 * 
 * CARDAMOM is distributed in the hope that it will be useful, but WITHOUT
 * ANY WARRANTY; without even the implied warranty of MERCHANTABILITY or
 * FITNESS FOR A PARTICULAR PURPOSE. See the GNU Library General Public
 * License for more details.
 * 
 * You should have received a copy of the GNU Library General
 * Public License along with CARDAMOM; see the file COPYING. If not, write to
 * the Free Software Foundation, Inc., 675 Mass Ave, Cambridge, MA 02139, USA.
 * =========================================================================== *
-->

<!--Cdmw deployment file for integration test:-->
<!--Cdmw Repository launched without traces-->
<!--One application that launches the functional test of the NamingInterface-->
<!DOCTYPE System SYSTEM "CdmwPlatformMngtSystem.dtd">


<!-- ***************** -->
<!-- System definition -->
<!--                   -->
<!-- ***************** -->
<System Name="Validation" Port="21869">

    <!-- Default timeouts for processes of the entire system -->
	<Timeout Init="20000" Run="20000" Stop="20000"/>

    <!-- Default monitorings for the entire system -->
	<Host-monitoring Pull-interval="1000" Pull-timeout="1500"/>
	<App-monitoring  Pull-interval="060" Pull-timeout="070"/>
    <Proc-monitoring Model="NO_MONITORING"
                     Pull-interval="021" Pull-timeout="031"
                     Push-interval="041" Push-timeout="051"/>

    <!-- Services of the system -->
	<Service Name="NamingAndRepositoryService"
             App-name="CdmwServices"
             Process-name="Repository"/>
				 

    <!-- Hosts of the system -->
	<Host Name="localhost"
          App-exec-path="./cdmw_platform_application"
          Agent-exec-path="./cdmw_platform_agent"
          Probe-exec-path="./cdmw_host_probe"/>

    <!-- ********************** -->
    <!-- Application definition -->
    <!--                        -->
    <!-- ********************** -->
	<Application Name="CdmwServices"
                 Host-name="localhost"
                 Agent-port="-1"
                 App-port="-1">

        <!-- Default timeouts for processes of this application -->
	    <Timeout Init="20000" Run="20000" Stop="20000"/>

        <!-- Monitoring of this application -->
    	<App-monitoring Pull-interval="021" Pull-timeout="031"/>


        <!-- ******************* -->
        <!-- Process definitions -->
        <!--                     -->
        <!-- ******************* -->
		<Managed-process Name="Repository"
                         Host-name="localhost"
                         Type="SERVICE-PROVIDER"
                         Autoended="FALSE"
                         Exec-path="./cdmw_naming_and_repository"
                         Args="--id=GlobalRepository --conf=../data/cdmw_nar_integ.xml"
                         Port="22456">
			<Init-step Name="initialisation" Timeout="10000"/>
			<Run-timeout Timeout="10000"/>
			<Stop-timeout Timeout="10000"/>
		</Managed-process>

		  <!-- ************************** -->
        <!--                            -->
        <!-- End of process definitions -->
        <!-- ************************** -->

        <!-- Init graph of processes of this application -->
                <Init-graph>
            <Graph-element Name="Repository">
            </Graph-element>
            <Graph-element-root Name="Repository"/>
        </Init-graph>

    <!-- ***************************** -->
    <!--                               -->
    <!-- End of application definition -->
    <!-- ***************************** -->
	</Application>

    <!-- ********************** -->
    <!-- Application definition -->
    <!--                        -->
    <!-- ********************** -->
	<Application Name="NamingInterfaceTest"
                 Host-name="localhost"
                 Agent-port="-1"
                 App-port="-1">

        <!-- Default timeouts for processes of this application -->
	    <Timeout Init="20000" Run="20000" Stop="20000"/>

        <!-- Monitoring of this application -->
    	<App-monitoring Pull-interval="021" Pull-timeout="031"/>


        <!-- ******************* -->
        <!-- Process definitions -->
        <!--                     -->
        <!-- ******************* -->
		<Managed-process Name="NamingInterfaceTest"
                         Host-name="localhost"
                         Type="MANAGED-PROCESS"
                         Autoended="TRUE"
                         Exec-path="./testNI"
                         Port="-1">
			<Init-step Name="initialisation" Timeout="10000"/>
			<Run-timeout Timeout="10000"/>
			<Stop-timeout Timeout="10000"/>
		</Managed-process>

		  <!-- ************************** -->
        <!--                            -->
        <!-- End of process definitions -->
        <!-- ************************** -->

        <!-- Init graph of processes of this application -->
                <Init-graph>
            <Graph-element Name="NamingInterfaceTest">
            </Graph-element>
            <Graph-element-root Name="NamingInterfaceTest"/>
        </Init-graph>

    <!-- ***************************** -->
    <!--                               -->
    <!-- End of application definition -->
    <!-- ***************************** -->
	</Application>


    <!-- Init graph of applications of the system-->
    <Init-graph>
        <Graph-element Name="CdmwServices"> 
            <Graph-element-successor Name="NamingInterfaceTest"/>
        </Graph-element>
        <Graph-element-root Name="CdmwServices"/> 
    </Init-graph>

</System>
<!-- ************************ -->
<!--                          -->
<!-- End of system definition -->
<!-- ************************ -->


